{
  "candidate": "clean-room-contract-skills-002",
  "track": "contract-plus-skills",
  "generatedBy": "GPT-5 Codex",
  "cleanRoom": true,
  "allowedInputs": [
    "benchmarks/component-fidelity/filter/clean-room/prompt.md",
    "benchmarks/component-fidelity/filter/clean-room/allowed-inputs.json",
    "benchmarks/component-fidelity/filter/clean-room/candidate.schema.json",
    "README.md",
    "AGENTS.md",
    "DESIGN.md",
    ".design/AGENT.md",
    ".design/INDEX.md",
    ".design/components/ACTIONS.md",
    ".design/components/COMMANDS-SEARCH.md",
    ".design/components/FORMS.md",
    ".design/components/DATA-DISPLAY.md",
    ".design/patterns/PAGES.md",
    ".design/patterns/SHELLS.md",
    ".design/verticals/web/BASE.md",
    ".design/verticals/web/APP.md",
    "templates/design/PROJECT.md",
    "templates/design/COMPONENTS.md",
    "templates/design/REFERENCES.md",
    "templates/design/COMPOSITION.json",
    "skills/design-system/SKILL.md",
    "skills/design-review/SKILL.md"
  ],
  "provenance": {
    "runId": "clean-room-contract-skills-002-2026-07-22",
    "model": "GPT-5 Codex",
    "operator": "OpenAI Codex",
    "generatedAt": "2026-07-22T00:00:00-04:00",
    "targetAccess": false,
    "promptSha256": "b84e37d71e99cb263023937d3f0c847e4358383057f750183a4b62e66a53581f",
    "allowedInputsSha256": "b39de608106ea369172be0a25c11d1d869e202cbba117b9716d4069c31b70a90",
    "allowedInputFiles": [
      "benchmarks/component-fidelity/filter/clean-room/prompt.md",
      "benchmarks/component-fidelity/filter/clean-room/allowed-inputs.json",
      "benchmarks/component-fidelity/filter/clean-room/candidate.schema.json",
      "README.md",
      "AGENTS.md",
      "DESIGN.md",
      ".design/AGENT.md",
      ".design/INDEX.md",
      ".design/components/ACTIONS.md",
      ".design/components/COMMANDS-SEARCH.md",
      ".design/components/FORMS.md",
      ".design/components/DATA-DISPLAY.md",
      ".design/patterns/PAGES.md",
      ".design/patterns/SHELLS.md",
      ".design/verticals/web/BASE.md",
      ".design/verticals/web/APP.md",
      "templates/design/PROJECT.md",
      "templates/design/COMPONENTS.md",
      "templates/design/REFERENCES.md",
      "templates/design/COMPOSITION.json",
      "skills/design-system/SKILL.md",
      "skills/design-review/SKILL.md"
    ],
    "cleanRoomAttestation": "I did not read the hidden target, existing or prior candidate files, scorer output, benchmark misses, or any files outside the allowed contract-plus-skills input list."
  },
  "anatomy": [
    "filter.root",
    "filter.leading-icon",
    "filter.value-label",
    "filter.count-badge",
    "filter.chevron",
    "filter.focus-ring",
    "filter.popover",
    "filter.option-row",
    "filter.option-check",
    "filter.empty-state"
  ],
  "tokens": {
    "height": 36,
    "paddingInline": 12,
    "gap": 8,
    "radius": 8,
    "background": "#171717",
    "foreground": "#f7f7f4",
    "border": "#2e2e2b",
    "mutedForeground": "#a7a29b",
    "accent": "#9eb7ff",
    "badgeBackground": "#262b35",
    "shadow": "0 8px 18px rgba(0, 0, 0, 0.22)",
    "fontFamily": "Inter",
    "fontWeight": 650,
    "labelSize": 13,
    "badgeSize": 11,
    "popoverWidth": 280,
    "optionHeight": 34
  },
  "states": {
    "hover": {
      "background": "#20201d",
      "border": "#3a3a36"
    },
    "focusVisible": {
      "outlineWidth": 2,
      "outlineColor": "#9eb7ff",
      "outlineOffset": 2
    },
    "open": {
      "background": "#20201d",
      "border": "#9eb7ff",
      "shadow": "0 12px 30px rgba(0, 0, 0, 0.28)"
    },
    "selected": {
      "optionBackground": "#232b3d",
      "optionForeground": "#f7f7f4",
      "checkColor": "#9eb7ff"
    },
    "disabled": {
      "background": "#151515",
      "foreground": "#706d68",
      "cursor": "not-allowed"
    },
    "empty": {
      "label": "No filters found",
      "foreground": "#a7a29b"
    }
  },
  "content": {
    "label": "Status",
    "value": "Open issues",
    "count": "12",
    "placeholder": "Filter status",
    "empty": "No filters found"
  }
}
